{
  "$schema": "https://json-schema.org/draft/2020-12/schema",
  "$id": "https://raw.githubusercontent.com/Swarek/context-room/main/schemas/config.schema.json",
  "title": "Context Room project configuration",
  "description": "Configuration for the local Context Room documentation control room.",
  "type": "object",
  "additionalProperties": true,
  "properties": {
    "$schema": {
      "type": "string",
      "description": "Optional JSON Schema URL for editor autocomplete."
    },
    "title": {
      "type": "string",
      "description": "Display title for this project."
    },
    "allowedPaths": {
      "type": "array",
      "description": "Safety boundary. Context Room can only read/write editable text files inside these files or folders.",
      "items": { "$ref": "#/$defs/projectPath" },
      "uniqueItems": true,
      "default": ["docs/", "context/", "skills/", "README.md", "AGENTS.md"]
    },
    "watchAllow": {
      "type": "array",
      "description": "Files or folders to monitor for the review queue. Changed tracked files and new untracked files under watched folders appear for verification.",
      "items": { "$ref": "#/$defs/projectPath" },
      "uniqueItems": true,
      "default": []
    },
    "reviewPaths": {
      "type": "array",
      "description": "Important files or folders that stay in the review queue until a human verifies the current content, even when there is no Git diff.",
      "items": { "$ref": "#/$defs/projectPath" },
      "uniqueItems": true,
      "default": []
    },
    "bestPractices": {
      "type": "array",
      "description": "Short documentation best practices shown in the Context Room hub.",
      "items": { "type": "string", "minLength": 1 },
      "default": []
    },
    "markdownTemplates": {
      "type": "array",
      "description": "Markdown templates available when creating new .md files from the site. Supports {{title}}, {{path}}, and metadata placeholders such as {{scope_yaml}}, {{status_yaml}}, {{canonical_for_yaml}}, {{last_verified_yaml}}, {{sources_inline}}, and {{sources_list}}.",
      "items": { "$ref": "#/$defs/markdownTemplate" },
      "default": []
    },
    "startupContext": {
      "type": "object",
      "description": "Optional scanner for agent instruction files above the Context Room root. These files are shown read-only and never added to the explorer.",
      "additionalProperties": true,
      "properties": {
        "enabled": { "type": "boolean", "default": false },
        "fileNames": {
          "type": "array",
          "items": { "type": "string", "minLength": 1 },
          "uniqueItems": true,
          "default": ["AGENTS.md", "CLAUDE.md"]
        }
      }
    },
    "startupSkills": {
      "type": "object",
      "description": "Optional scanner for skill folders above the Context Room root. These folders are shown read-only and never added to the explorer.",
      "additionalProperties": true,
      "properties": {
        "enabled": { "type": "boolean", "default": true },
        "folderNames": {
          "type": "array",
          "items": { "type": "string", "minLength": 1 },
          "uniqueItems": true,
          "default": [".codex/skills", "skills"]
        }
      }
    },
    "appearance": {
      "type": "object",
      "description": "Visual preferences for the Context Room webapp.",
      "additionalProperties": true,
      "properties": {
        "fileTheme": {
          "type": "string",
          "description": "Theme used for file reading and editing surfaces.",
          "enum": ["context-room", "vscode-dark", "github-dark", "dracula", "solarized-dark", "light-plus"],
          "default": "context-room"
        },
        "autoOpenGitDiff": {
          "type": "boolean",
          "description": "When true, files with a Git diff open with the diff panel visible. When false, the diff stays collapsed until the user opens it manually.",
          "default": true
        }
      }
    },
    "hubCards": {
      "type": "object",
      "description": "Legacy card visibility map. Prefer hubSections for new setups.",
      "additionalProperties": { "type": "boolean" }
    },
    "customHubCards": {
      "type": "array",
      "description": "Legacy flat custom card list. Prefer hubSections for new setups.",
      "items": { "$ref": "#/$defs/card" }
    },
    "hubSections": {
      "type": "array",
      "description": "Top-level groups shown in the Context Room hub.",
      "items": { "$ref": "#/$defs/section" }
    },
    "integrations": {
      "type": "object",
      "description": "Optional integrations. Keep false/empty for generic projects.",
      "additionalProperties": true,
      "properties": {
        "hermes": {
          "type": "boolean",
          "description": "Enable Hermes-specific files and external skill paths. Off by default for generic projects.",
          "default": false
        }
      }
    }
  },
  "required": ["title", "allowedPaths", "watchAllow", "hubSections"],
  "$defs": {
    "projectPath": {
      "type": "string",
      "minLength": 1,
      "not": { "pattern": "(^/|^\\.\\.|/\\.\\./|\\u0000)" },
      "examples": ["README.md", "AGENTS.md", "docs/", "context/architecture.md", "skills/review.md"]
    },
    "section": {
      "type": "object",
      "additionalProperties": true,
      "required": ["id", "title", "cards"],
      "properties": {
        "id": { "$ref": "#/$defs/id" },
        "title": { "type": "string" },
        "description": { "type": "string" },
        "enabled": { "type": "boolean", "default": true },
        "cards": {
          "type": "array",
          "items": { "$ref": "#/$defs/card" }
        }
      }
    },
    "card": {
      "type": "object",
      "additionalProperties": true,
      "required": ["id", "title"],
      "oneOf": [
        { "required": ["path"] },
        { "required": ["paths"] },
        { "required": ["cards"] }
      ],
      "properties": {
        "id": { "$ref": "#/$defs/id" },
        "title": { "type": "string" },
        "description": { "type": "string" },
        "path": { "$ref": "#/$defs/projectPath" },
        "paths": {
          "type": "array",
          "items": { "$ref": "#/$defs/projectPath" },
          "uniqueItems": true
        },
        "enabled": { "type": "boolean", "default": true },
        "autoChildren": {
          "type": "boolean",
          "description": "When true and the card points to a folder, Context Room infers child cards from the folder's immediate files and subfolders.",
          "default": false
        },
        "cards": {
          "type": "array",
          "description": "Nested cards/sub-cards.",
          "items": { "$ref": "#/$defs/card" }
        }
      }
    },
    "markdownTemplate": {
      "type": "object",
      "additionalProperties": true,
      "required": ["id", "title", "content"],
      "properties": {
        "id": { "$ref": "#/$defs/id" },
        "title": { "type": "string" },
        "description": { "type": "string" },
        "enabled": {
          "type": "boolean",
          "description": "When false, keep this template editable in settings but hide it from the apply-template selector.",
          "default": true
        },
        "content": {
          "type": "string",
          "description": "Template body. Supports {{title}}, {{path}}, and metadata placeholders such as {{scope_yaml}}, {{status_yaml}}, {{canonical_for_yaml}}, {{last_verified_yaml}}, {{sources_inline}}, and {{sources_list}}."
        }
      }
    },
    "id": {
      "type": "string",
      "pattern": "^[a-z0-9][a-z0-9_-]*$",
      "examples": ["docs", "agent-context", "skills"]
    }
  }
}
